{
  "schema_version": "fabricctl.bundle-build/v1",
  "status": "pass",
  "readiness": "unverified",
  "bundle_digest": "sha256:1111111111111111111111111111111111111111111111111111111111111111",
  "artifacts": [
    "/review/bundle/singleaxis.yaml",
    "/review/bundle/install-target.yaml",
    "/review/bundle/fabric-values.yaml",
    "/review/bundle/secrets-required.yaml",
    "/review/bundle/installation-plan.json",
    "/review/bundle/bundle-manifest.json"
  ]
}
